$ tcpdump -i eth1
$ tcpdump -c 2 -i eth0
$ tcpdump -A -i eth0
$tcpdump -XX -i eth0
$ tcpdump -w 08232010.pcap -i eth0
$ tcpdump -i eth0 arp
tcpdump -i eth0 arp
tcpdump: verbose output suppressed, use -v or -vv for full protocol decode
listening on eth0, link-type EN10MB (Ethernet), capture size 65535 bytes
17:50:42.290030 ARP, Request who-has 192.168.164.129 tell 192.168.164.2, length 46
17:50:42.290048 ARP, Reply 192.168.164.129 is-at 00:0c:29:b1:ee:d3 (oui Unknown), length 28
17:51:42.892058 ARP, Request who-has 192.168.164.254 tell 192.168.164.129, length 28
17:51:42.892230 ARP, Reply 192.168.164.254 is-at 00:50:56:fa:4b:aa (oui Unknown), length 46
$ tcpdump -i eth0 port 22
$ tcpdump -w xpackets.pcap -i eth0 dst 172.19.73.109 and port 22
$tcpdump -w comm.pcap -i eth0 dst 16.181.170.246 and port 22
